<?xml version="1.0" encoding="UTF-8"?>
<!DOCTYPE pagemodel SYSTEM  "E:\IdeaProjects\vrmframework\src\main\java\org\vrmframework\dtd\ModelConfig.dtd">
<pagemodel ref="com.application.realmodel.pagemodel.FamilyAddressPageModel">



	<datamodels>
		<datamodel did = "familyServiceModel" dclass ="com.application.realmodel.datamodel.FamilyServiceModel"/>
	</datamodels>


	<situation sid="default" sif="null">
		<field fname = "street" fvalue="{address.street}" v-ref="familyServiceModel"/>
		<field fname = "province" fvalue="{address.province}" v-ref="familyServiceModel"/>
		<field fname = "city" fvalue="{address.city}" v-ref="familyServiceModel"/>
		<field fname = "county" fvalue="{address.county}" v-ref="familyServiceModel"/>
	</situation>

</pagemodel>